{
  "apiVersion": "modos.pleiades/v1alpha1",
  "authority": {
    "canonicalMutationApplied": false,
    "ceiling": "none",
    "promotionState": "eligible-for-review",
    "promotionTransactionRequired": true
  },
  "checks": [
    {"name": "unique-object-identities", "status": "pass"},
    {"name": "supported-object-families", "status": "pass"},
    {"name": "closed-relation-endpoints", "status": "pass"},
    {"name": "unique-relations", "status": "pass"},
    {"name": "polycentric-mind-boundary", "status": "pass"},
    {"name": "source-digest-bound", "status": "pass"},
    {"name": "authority-monotonicity", "status": "pass"},
    {"name": "proposal-only-no-promotion", "status": "pass"}
  ],
  "closureStatus": "closed",
  "compiler": {
    "canonicalization": "pleiades-canonical-json-v1",
    "name": "pleiades-ontology-compiler",
    "version": "0.1.0"
  },
  "counts": {
    "resultObjects": 2,
    "resultRelations": 1,
    "sourceObjects": 2,
    "sourceRelations": 0
  },
  "kind": "OntologyClosureReceipt",
  "mindId": "mind:pleiades",
  "proposalDigest": "sha256:b0c47a912e435975009f9bcea84cf9fc1425b37dc45d16313e29ce7c2771d8b5",
  "proposalId": "proposal:link-workspace-0001",
  "resultSnapshotDigest": "sha256:fb24a0a0c1394fc8f4a45df9e68eb5d8ed9a3e849882c19ff0b743ffd8202196",
  "schemaVersion": "v1alpha1",
  "semanticDiff": {
    "objectsAdded": [],
    "objectsDeleted": [],
    "objectsUpdated": [],
    "relationsAdded": [
      {
        "sourceRef": "mind:pleiades",
        "targetRef": "workspace:pleiades",
        "type": "participatesIn"
      }
    ],
    "relationsRemoved": []
  },
  "sourceSnapshotDigest": "sha256:6cdb735ccdd132b7c86a7f60df6f953138f3555bfc362708947f7a8f5832ea51"
}
